{"$schema":"https://json-schema.org/draft/2020-12/schema","$id":"schemas/behavior-context-receipt.schema.json","type":"object","additionalProperties":false,"required":["schema_version","selected_module","authorized_behavior_sources_sha256","context_plan_sha256","batch_result_sha256s","fragment_registry","source_outcomes"],"properties":{"schema_version":{"const":"1.0.0"},"selected_module":{"type":"string","minLength":1},"authorized_behavior_sources_sha256":{"type":"string","pattern":"^sha256:[0-9a-f]{64}$"},"context_plan_sha256":{"type":"string","pattern":"^sha256:[0-9a-f]{64}$"},"batch_result_sha256s":{"type":"array","items":{"type":"string","pattern":"^sha256:[0-9a-f]{64}$"}},"fragment_registry":{"type":"array","items":{"type":"object","additionalProperties":false,"required":["fragment_id","source_id","item_id"],"properties":{"fragment_id":{"type":"string","pattern":"^FRAGMENT-[0-9a-f]{64}$"},"source_id":{"type":"string","minLength":1},"item_id":{"type":"string","pattern":"^ITEM-[0-9]{6}$"}}}},"source_outcomes":{"type":"array","items":{"type":"object","additionalProperties":false,"required":["source_id","domain_key","outcome"],"properties":{"source_id":{"type":"string","minLength":1},"domain_key":{"type":"string","minLength":1},"outcome":{"enum":["behavior_fragments","no_supported_observable_fact"]}}}}}}
