{"authorized_behavior_sources_sha256":"sha256:20f471419bdde00fcb970a0008fffe75dd571f986946e8cb4af4599a2b81aebf","batch_result_sha256s":["sha256:9b487882eb114adce4bb1b168b99eedc91d616ed07139fa0dd0967b552633c29","sha256:754121b83bce2288b7e8a5705fb4ed92eb6945e519cacc5f52cf393f844f05f1"],"context_plan_sha256":"sha256:72e56f2911c9d9311bfee87f884d83f006ae9f4fb1ff80792071a05c1e7ce01e","fragment_registry":[{"fragment_id":"FRAGMENT-0000000000000000000000000000000000000000000000000000000000000001","item_id":"ITEM-000001","source_id":"REQ-synthetic"},{"fragment_id":"FRAGMENT-0000000000000000000000000000000000000000000000000000000000000002","item_id":"ITEM-000002","source_id":"SOURCE-fd794e4081e27177d36a68cf917f712c6981d175c3bf3d45f890367a92645c75"}],"schema_version":"1.0.0","selected_module":"backend","source_outcomes":[{"domain_key":"_supplied","outcome":"behavior_fragments","source_id":"REQ-synthetic"},{"domain_key":"_root","outcome":"behavior_fragments","source_id":"SOURCE-fd794e4081e27177d36a68cf917f712c6981d175c3bf3d45f890367a92645c75"}]}
